{},"500 E Arapaho Rd #201, Richardson, TX 75081",False,,OPERATIONAL,,16681046648011001779,Richardson,500 East Arapaho Road,Richardson,United States,"We are one of the most trusted electricians that service the Richardson, Dallas, Plano & Frisco areas. We do Federal Pacific, Zinsco electrical panel replacements, troubleshooting, chandalier & recessed lighting installation.",50.0,,2017.0,CONSTRUCTION,False,"We are one of the most trusted electricians that service the Richardson, Dallas, Plano & Frisco areas. We do Federal Pacific, Zinsco electrical panel replacements, troubleshooting, chandalier & recessed lighting installation.",,All In One Electric,+1 972-231-0958,,landline,10000000.0,TX,America/Chicago,,,75081,United States of America,US,,,0x864c1f1078a03559:0xe77efb8be06a8fb3,8926c8295d3ffff,/g/1tfgk6gb,32.9575585,,,"https://www.google.com/maps/place/All-In-One+Electric/@32.9575585,-96.71699029999999,14z/data=!4m8!1m2!2m1!1sAll-In-One+Electric!3m4!1s0x864c1f1078a03559:0xe77efb8be06a8fb3!8m2!3d32.9575585!4d-96.71699029999999","https://www.google.com/maps/place/All-In-One+Electric/@32.9575585,-96.71699029999999,13.99z/data=!4m16!1m7!3m6!1s0x864c1f1078a03559:0xe77efb8be06a8fb3!2sAll-In-One+Electric!8m2!3d32.9575585!4d-96.71699029999999!16s%2Fg%2F11ckvg1dmb!3m7!1s0x864c1f1078a03559:0xe77efb8be06a8fb3!8m2!3d32.9575585!4d-96.71699029999999!9m1!1b1!16s%2Fg%2F11ckvg1dmb?entry=ttu",https://lh6.googleusercontent.com/-m2La55lO2Qs/AAAAAAAAAAI/AAAAAAAAAAA/shaQDBCSzpo/s44-p-k-no-ns-nd/photo.jpg,-96.71699029999999,,All-In-One Electric,All In One Electric,,,117197688571820640328,https://www.google.com/maps/contrib/117197688571820640328,All-In-One Electric,+1 214-878-0741,T-Mobile USA Inc.,mobile,https://lh3.googleusercontent.com/p/AF1QipNMpuq4DbHjPeqp7WrdGy3zQcTtjog3kC-uriKP=w800-h500-k-no,23,ChIJWTWgeBAfTIYRs49q4Iv7fuc,,,75081,,,"Electrician near Garland, TX",,4.7,,,,,,,Texas,TX,500 E Arapaho Rd #201,,"Electrician, Lighting contractor",America/Chicago,Electrician,,True,https://www.allinoneelectric.com/%3Futm_source%3DGBP,{'Thursday': ['Open 24 hours']},
{},"2914 Industrial Ln, Garland, TX 75041",False,,OPERATIONAL,,18205807101969143280,Garland,,,,,,,,,,,,,,,,,,,,,,United States of America,US,,,0x864ea0b82d962d2b:0xfca80519ca2795f0,8926c82999bffff,/g/1tdbr8jm,32.8810572,,,"https://www.google.com/maps/place/Birdsong+Electric+Inc/@32.8810572,-96.67510709999999,14z/data=!4m8!1m2!2m1!1sBirdsong+Electric+Inc!3m4!1s0x864ea0b82d962d2b:0xfca80519ca2795f0!8m2!3d32.8810572!4d-96.67510709999999","https://www.google.com/maps/place/Birdsong+Electric+Inc/@32.8810572,-96.67510709999999,13.99z/data=!4m16!1m7!3m6!1s0x864ea0b82d962d2b:0xfca80519ca2795f0!2sBirdsong+Electric+Inc!8m2!3d32.8810572!4d-96.67510709999999!16s%2Fg%2F11ckvg1dmb!3m7!1s0x864ea0b82d962d2b:0xfca80519ca2795f0!8m2!3d32.8810572!4d-96.67510709999999!9m1!1b1!16s%2Fg%2F11ckvg1dmb?entry=ttu",https://lh4.googleusercontent.com/-Z8zoXWfeQ-4/AAAAAAAAAAI/AAAAAAAAAAA/CP7S5mZpFGA/s44-p-k-no-ns-nd/photo.jpg,-96.67510709999999,,Birdsong Electric Inc,Birdsong Electric,,,102969522689658651930,https://www.google.com/maps/contrib/102969522689658651930,Birdsong Electric Inc,+1 972-295-3000,,landline,https://streetviewpixels-pa.googleapis.com/v1/thumbnail?panoid=JFAzeIyfG2aX5fdk3-IFow&cb_client=search.gws-prod.gps&w=800&h=500&yaw=102.702965&pitch=0&thumbfov=100,1,ChIJKy2WLbigToYR8JUnyhkFqPw,,,75041,,,"Electrician near Garland, TX",,4.4,,,,,,,Texas,TX,2914 Industrial Ln,https://streetviewpixels-pa.googleapis.com/v1/thumbnail?panoid=JFAzeIyfG2aX5fdk3-IFow&cb_client=search.gws-prod.gps&w=1600&h=1000&yaw=102.702965&pitch=0&thumbfov=100,"Electrician, Property maintenance, Swimming pool repair service",America/Chicago,Electrician,,True,https://birdsongelectric.jobbersites.com/,{'Thursday': ['Open 24 hours']},
{},"200 Rayburn St, Garland, TX 75040",False,,OPERATIONAL,,8333538458212679329,Garland,200 Rayburn Street,Garland,United States,regions electric is a family-owned electrical company that is dedicated to providing high-quality electrical services. Our mission is to stand behind our work and ensure accuracy and completeness. We believe that effective planning is essential for pro...,10.0,,,CONSTRUCTION,False,regions electric is a family-owned electrical company that is dedicated to providing high-quality electrical services. Our mission is to stand behind our work and ensure accuracy and completeness. We believe that effective planning is essential for pro...,https://www.linkedin.com/company/regions-electric-inc,regions electric,,,,1000000.0,TX,America/Chicago,,,75040,United States of America,US,,,0x864c1d844d090b0f:0x73a6ad1323d2bea1,8926c828c57ffff,/g/11c1vj35c8,32.9109897,,,"https://www.google.com/maps/place/Regions+Electric%2C+Inc./@32.9109897,-96.62891979999999,14z/data=!4m8!1m2!2m1!1sRegions+Electric%2C+Inc.!3m4!1s0x864c1d844d090b0f:0x73a6ad1323d2bea1!8m2!3d32.9109897!4d-96.62891979999999","https://www.google.com/maps/place/Regions+Electric%2C+Inc./@32.9109897,-96.62891979999999,13.99z/data=!4m16!1m7!3m6!1s0x864c1d844d090b0f:0x73a6ad1323d2bea1!2sRegions+Electric%2C+Inc.!8m2!3d32.9109897!4d-96.62891979999999!16s%2Fg%2F11ckvg1dmb!3m7!1s0x864c1d844d090b0f:0x73a6ad1323d2bea1!8m2!3d32.9109897!4d-96.62891979999999!9m1!1b1!16s%2Fg%2F11ckvg1dmb?entry=ttu",https://lh3.googleusercontent.com/-uVWPTBjrIK0/AAAAAAAAAAI/AAAAAAAAAAA/ez64zWg3-_Q/s44-p-k-no-ns-nd/photo.jpg,-96.62891979999999,,"Regions Electric, Inc.",Regions Electric,,,101464225834544917923,https://www.google.com/maps/contrib/101464225834544917923,"Regions Electric, Inc.",+1 972-272-7220,,landline,https://lh3.googleusercontent.com/p/AF1QipO04E6FxUqPSNZmFK02VIaTsa6wqNpOAGgf4bZS=w800-h500-k-no,2,ChIJDwsJTYQdTIYRob7SIxOtpnM,,,75040,,,"Electrician near Garland, TX",,4.6,,,,,,,Texas,TX,200 Rayburn St,https://streetviewpixels-pa.googleapis.com/v1/thumbnail?panoid=Bu3O_-FNj-bBdK_RNf5U4A&cb_client=search.gws-prod.gps&w=1600&h=1000&yaw=351.82285&pitch=0&thumbfov=100,Electrician,America/Chicago,Electrician,,True,https://regionselectric.com/,{'Thursday': ['8AM-5PM']},"Thursday,8AM,5PM"
{},"2610 Palisades Pl, Mesquite, TX 75181",False,,OPERATIONAL,,7096899142252125796,Mesquite,2610 Palisades Place,Mesquite,United States,"Mend Electric provides reliable 24-hour electrical repair, maintenance, and installation services to residential and commercial clients in the Dallas and Fort Worth Metroplex, ensuring high-quality workmanship and customer satisfaction.",,,,ELECTRICAL_ELECTRONIC_MANUFACTURING,False,"Mend Electric provides reliable 24-hour electrical repair, maintenance, and installation services to residential and commercial clients in the Dallas and Fort Worth Metroplex, ensuring high-quality workmanship and customer satisfaction.",,Mend Electric,+1 214-985-2494,T-Mobile USA Inc.,mobile,,TX,America/Chicago,,,75181,United States of America,US,Creek Crossing Estates,,0x864eafde744e8191:0x627d402b3cb65e64,8926cb9750fffff,/g/11c6vv79_x,32.7329226,,,"https://www.google.com/maps/place/Mend+Electric+LLC/@32.7329226,-96.5554081,14z/data=!4m8!1m2!2m1!1sMend+Electric+LLC!3m4!1s0x864eafde744e8191:0x627d402b3cb65e64!8m2!3d32.7329226!4d-96.5554081","https://www.google.com/maps/place/Mend+Electric+LLC/@32.7329226,-96.5554081,13.99z/data=!4m16!1m7!3m6!1s0x864eafde744e8191:0x627d402b3cb65e64!2sMend+Electric+LLC!8m2!3d32.7329226!4d-96.5554081!16s%2Fg%2F11ckvg1dmb!3m7!1s0x864eafde744e8191:0x627d402b3cb65e64!8m2!3d32.7329226!4d-96.5554081!9m1!1b1!16s%2Fg%2F11ckvg1dmb?entry=ttu",https://lh4.googleusercontent.com/-aHzcZbfWMGM/AAAAAAAAAAI/AAAAAAAAAAA/83jJbmn8cWI/s44-p-k-no-ns-nd/photo.jpg,-96.5554081,,Mend Electric LLC,Mend Electric,,,100920541260832178577,https://www.google.com/maps/contrib/100920541260832178577,Mend Electric LLC,+1 214-985-2494,T-Mobile USA Inc.,mobile,https://lh3.googleusercontent.com/p/AF1QipOSfR7Y4Qrow-luBzOpH8U1nkucxtsC9KDfBBYO=w800-h500-k-no,110,ChIJkYFOdN6vToYRZF62PCtAfWI,,,75181,,,"Electrician near Mesquite, TX",,4.9,,,,,,,Texas,TX,2610 Palisades Pl,,"Electrician, Electrical installation service",America/Chicago,Electrician,,True,http://mendelectrictx.com/,{'Wednesday': ['Open 24 hours']},
{},"1406 Rodeo Center Blvd, Mesquite, TX 75149",False,,OPERATIONAL,,8797646002981377361,Mesquite,,Mesquite,United States,"Matrix Electric Company offers a comprehensive mix of commercial and residential electrical services tailored to meet the unique needs of your business or home in Mesquite, TX and the surrounding areas.",,,,Electrical Services,,,,Matrix Electric Company,,,,,TX,America/Chicago,,,,United States of America,US,Hickory Heights,,0x864ea4e1c12fa321:0x7a17846d83571551,8926cb92b77ffff,/g/1tw_nnv_,32.7503905,,,"https://www.google.com/maps/place/Matrix+Electric/@32.7503905,-96.6221987,14z/data=!4m8!1m2!2m1!1sMatrix+Electric!3m4!1s0x864ea4e1c12fa321:0x7a17846d83571551!8m2!3d32.7503905!4d-96.6221987","https://www.google.com/maps/place/Matrix+Electric/@32.7503905,-96.6221987,13.99z/data=!4m16!1m7!3m6!1s0x864ea4e1c12fa321:0x7a17846d83571551!2sMatrix+Electric!8m2!3d32.7503905!4d-96.6221987!16s%2Fg%2F11ckvg1dmb!3m7!1s0x864ea4e1c12fa321:0x7a17846d83571551!8m2!3d32.7503905!4d-96.6221987!9m1!1b1!16s%2Fg%2F11ckvg1dmb?entry=ttu",https://lh5.googleusercontent.com/-KBIQN4st0ss/AAAAAAAAAAI/AAAAAAAAAAA/4Dsjjwrmxto/s44-p-k-no-ns-nd/photo.jpg,-96.6221987,,Matrix Electric,Matrix Electric,,,110331283335368929575,https://www.google.com/maps/contrib/110331283335368929575,Matrix Electric,+1 469-253-2564,,landline,https://lh3.googleusercontent.com/p/AF1QipP5F9yHgr5XQ4kQyAgAZyR0LoOd9JU0m-Onpoqx=w800-h500-k-no,32,ChIJIaMvweGkToYRURVXg22EF3o,,,75149,,,"Electrician near Mesquite, TX",,4.9,,,,,,,Texas,TX,1406 Rodeo Center Blvd,,Electrician,America/Chicago,Electrician,,True,https://www.matrixelectriccompany.com/,{'Wednesday': ['7AM-4PM']},"Wednesday,7AM,4PM"
{},"1515 N Town E Blvd, Mesquite, TX 75150",False,,OPERATIONAL,,6300936073346162902,Mesquite,1515 North Town East Boulevard,Mesquite,United States,"Licensed, insured, master electrician serving the Dallas Fort Worth area, including Plano, Rockwall, Richardson, Frisco, McKinney & more! 214-728-1977",50.0,,2016.0,,False,"Licensed, insured, master electrician serving the Dallas Fort Worth area, including Plano, Rockwall, Richardson, Frisco, McKinney & more! 214-728-1977",,5th Gen Electric,,,,10000000.0,TX,America/Chicago,,5thgenelectric,75150,United States of America,US,The Emporium,,0x864ea42ad6bbb6a1:0x57716bf9943e20d6,8926cb92cc3ffff,/g/11c1rdg5cd,32.8114002,,,"https://www.google.com/maps/place/5th+Generation+Electric+LLC/@32.8114002,-96.6214349,14z/data=!4m8!1m2!2m1!1s5th+Generation+Electric+LLC!3m4!1s0x864ea42ad6bbb6a1:0x57716bf9943e20d6!8m2!3d32.8114002!4d-96.6214349","https://www.google.com/maps/place/5th+Generation+Electric+LLC/@32.8114002,-96.6214349,13.99z/data=!4m16!1m7!3m6!1s0x864ea42ad6bbb6a1:0x57716bf9943e20d6!2s5th+Generation+Electric+LLC!8m2!3d32.8114002!4d-96.6214349!16s%2Fg%2F11ckvg1dmb!3m7!1s0x864ea42ad6bbb6a1:0x57716bf9943e20d6!8m2!3d32.8114002!4d-96.6214349!9m1!1b1!16s%2Fg%2F11ckvg1dmb?entry=ttu",https://lh3.googleusercontent.com/-RPE_blj49BU/AAAAAAAAAAI/AAAAAAAAAAA/YGyBYVwwpiQ/s44-p-k-no-ns-nd/photo.jpg,-96.6214349,,5th Generation Electric LLC,5Th Generation Electric,,,117087564481296967570,https://www.google.com/maps/contrib/117087564481296967570,5th Generation Electric LLC,+1 214-728-1977,"NEW CINGULAR WIRELESS PCS, LLC - IL",mobile,https://lh3.googleusercontent.com/p/AF1QipPb0Ek8Rt9pd4UKq-aEVyVHmIJVXwRlR5eTV9z_=w800-h500-k-no,84,ChIJoba71iqkToYR1iA-lPlrcVc,,,75150,,,"Electrician near Mesquite, TX",,4.9,,,,,,,Texas,TX,1515 N Town E Blvd,,Electrician,America/Chicago,Electrician,,True,http://www.5thgenelectric.com/,{'Wednesday': ['8AM-4PM']},"Wednesday,8AM,4PM"
{},"4111 US-80 Suite 206, Mesquite, TX 75150",False,,OPERATIONAL,,14155054971198968419,Mesquite,4111 U.S. 80,Mesquite,United States,,,https://facebook.com/bh3ind,,,False,,,bh3ind.com,,,,,TX,America/Chicago,,,75150,United States of America,US,Hi-point Square,,0x864ead20bb64ecd7:0xc470db7fe6711263,8926cb90583ffff,/g/11l_c50cqg,32.7959068,,,"https://www.google.com/maps/place/BH3+Residential+and+Commercial+Electricians/@32.7959068,-96.66076679999999,14z/data=!4m8!1m2!2m1!1sBH3+Residential+and+Commercial+Electricians!3m4!1s0x864ead20bb64ecd7:0xc470db7fe6711263!8m2!3d32.7959068!4d-96.66076679999999","https://www.google.com/maps/place/BH3+Residential+and+Commercial+Electricians/@32.7959068,-96.66076679999999,13.99z/data=!4m16!1m7!3m6!1s0x864ead20bb64ecd7:0xc470db7fe6711263!2sBH3+Residential+and+Commercial+Electricians!8m2!3d32.7959068!4d-96.66076679999999!16s%2Fg%2F11ckvg1dmb!3m7!1s0x864ead20bb64ecd7:0xc470db7fe6711263!8m2!3d32.7959068!4d-96.66076679999999!9m1!1b1!16s%2Fg%2F11ckvg1dmb?entry=ttu",https://lh6.googleusercontent.com/-_EGMv0KyIwg/AAAAAAAAAAI/AAAAAAAAAAA/mFFwPm3IEss/s44-p-k-no-ns-nd/photo.jpg,-96.66076679999999,,BH3 Residential and Commercial Electricians,Bh3 Residential And Commercial Electricians,,,115950978543874302455,https://www.google.com/maps/contrib/115950978543874302455,BH3 Residential and Commercial Electricians,+1 972-761-1973,,landline,https://lh3.googleusercontent.com/p/AF1QipNm7-iGCmaPUuojFWXa5fZRfcfVKz2CWn5qXQE3=w800-h500-k-no,62,ChIJ1-xkuyCtToYRYxJx5n_bcMQ,,,75150,,,"Electrician near Mesquite, TX",,4.9,,,,,,,Texas,TX,4111 US-80 Suite 206,,"Electrician, Electrical installation service",America/Chicago,Electrician,,True,https://www.bh3ind.com/,{'Wednesday': ['Open 24 hours']},
{},"919 N Peachtree Rd, Mesquite, TX 75149",False,,OPERATIONAL,,8950375522526741874,Mesquite,PO BOX 851174,Mesquite,United States,"Electrical Contractor in Dallas, Residential, Commercial, Lighting, Electrician, LED lights, Recessed lighting, Panel upgrades. RING & NEST Products 214-468-4041",50.0,,2017.0,,False,"Electrical Contractor in Dallas, Residential, Commercial, Lighting, Electrician, LED lights, Recessed lighting, Panel upgrades. RING & NEST Products 214-468-4041",,ELECTRICOWORK.COM,2144684041,,voip,10000000.0,TX,America/Chicago,,,75185,United States of America,US,Skyline,,0x864ea4e55769719d:0x7c361f1dda8ec572,8926cb92843ffff,/g/11gcmz5gq7,32.780302999999996,,,"https://www.google.com/maps/place/Electricowork%2C+LLC/@32.780302999999996,-96.630343,14z/data=!4m8!1m2!2m1!1sElectricowork%2C+LLC!3m4!1s0x864ea4e55769719d:0x7c361f1dda8ec572!8m2!3d32.780302999999996!4d-96.630343","https://www.google.com/maps/place/Electricowork%2C+LLC/@32.780302999999996,-96.630343,13.99z/data=!4m16!1m7!3m6!1s0x864ea4e55769719d:0x7c361f1dda8ec572!2sElectricowork%2C+LLC!8m2!3d32.780302999999996!4d-96.630343!16s%2Fg%2F11ckvg1dmb!3m7!1s0x864ea4e55769719d:0x7c361f1dda8ec572!8m2!3d32.780302999999996!4d-96.630343!9m1!1b1!16s%2Fg%2F11ckvg1dmb?entry=ttu",https://lh3.googleusercontent.com/-qBIMOb_xvD4/AAAAAAAAAAI/AAAAAAAAAAA/qxEYi3krj-M/s44-p-k-no-ns-nd/photo.jpg,-96.630343,,"Electricowork, LLC",Electricowork,,,107246295393771735353,https://www.google.com/maps/contrib/107246295393771735353,"Electricowork, LLC",+1 214-468-4041,,voip,https://lh3.googleusercontent.com/p/AF1QipNJV4kpRu6pvkRs-sUjf4Hx12pspl4tQj6gHIMG=w800-h500-k-no,128,ChIJnXFpV-WkToYRcsWO2h0fNnw,,,75149,,,"Electrician near Mesquite, TX",,5.0,,,,,,,Texas,TX,919 N Peachtree Rd,,"Electrician, Lighting contractor, Repair service",America/Chicago,Electrician,,True,http://www.electricowork.com/,{'Wednesday': ['8AM-5PM']},"Wednesday,8AM,5PM"
"{'Accessibility': {'Wheelchair accessible entrance': True, 'Wheelchair accessible parking lot': True}}","1210 W Scyene Rd, Mesquite, TX 75149",False,,OPERATIONAL,,13867319148650252432,Mesquite,,,,,,,,,,,,,,,,,,,,,,United States of America,US,Blue Bell Heights,,0x864ea5074158cc41:0xc0729d4b22454890,8926cb9282fffff,/g/1tctxzg2,32.767901,,,"https://www.google.com/maps/place/A+R+Electric/@32.767901,-96.6146947,14z/data=!4m8!1m2!2m1!1sA+R+Electric!3m4!1s0x864ea5074158cc41:0xc0729d4b22454890!8m2!3d32.767901!4d-96.6146947","https://www.google.com/maps/place/A+R+Electric/@32.767901,-96.6146947,13.99z/data=!4m16!1m7!3m6!1s0x864ea5074158cc41:0xc0729d4b22454890!2sA+R+Electric!8m2!3d32.767901!4d-96.6146947!16s%2Fg%2F11ckvg1dmb!3m7!1s0x864ea5074158cc41:0xc0729d4b22454890!8m2!3d32.767901!4d-96.6146947!9m1!1b1!16s%2Fg%2F11ckvg1dmb?entry=ttu",https://lh3.googleusercontent.com/-92xX7cnsaHU/AAAAAAAAAAI/AAAAAAAAAAA/6MrmnfpPDWg/s44-p-k-no-ns-nd/photo.jpg,-96.6146947,,A R Electric,A R Electric,,,112072214596770782765,https://www.google.com/maps/contrib/112072214596770782765,A R Electric,+1 972-285-7525,,landline,https://streetviewpixels-pa.googleapis.com/v1/thumbnail?panoid=JIw77bCOiGUKF53nKvkqPw&cb_client=search.gws-prod.gps&w=800&h=500&yaw=104.26168&pitch=0&thumbfov=100,1,ChIJQcxYQQelToYRkEhFIkudcsA,,,75149,,,"Electrician near Mesquite, TX",,4.1,,,,,,,Texas,TX,1210 W Scyene Rd,https://streetviewpixels-pa.googleapis.com/v1/thumbnail?panoid=JIw77bCOiGUKF53nKvkqPw&cb_client=search.gws-prod.gps&w=1600&h=1000&yaw=104.26168&pitch=0&thumbfov=100,"Electrician, Contractor, Swimming pool contractor",America/Chicago,Electrician,,True,,,
{'Accessibility': {'Wheelchair accessible entrance': True}},"2615 Big Town Blvd, Mesquite, TX 75150",False,,OPERATIONAL,,4316021665015913078,Mesquite,2615 Big Town Boulevard,Mesquite,United States,"Baker Brothers Plumbing, Air Conditioning & Electrical: Top-rated Dallas company offering 24/7 plumbing, HVAC, & electrical services with cutting-edge technology and expert technicians for over 70 years.",250.0,https://facebook.com/bakerbrothersplumbing,1945.0,CONSTRUCTION,False,"Baker Brothers Plumbing, Air Conditioning & Electrical: Top-rated Dallas company offering 24/7 plumbing, HVAC, & electrical services with cutting-edge technology and expert technicians for over 70 years.",https://www.linkedin.com/company/baker-brothers-plumbing-&-air-conditioning,Baker Brothers,+1 214-892-2225,"BANDWIDTH.COM CLEC, LLC - TX",fixed line,10000000.0,TX,America/Chicago,,BakerBrosPlmbg,75150,United States of America,US,,,0x864e99246aaaaaab:0x3be596d64a29da76,8926cb9236bffff,/g/1tgxjgf1,32.800499099999996,,,"https://www.google.com/maps/place/Baker+Brothers+Plumbing%2C+Air+%26+Electric/@32.800499099999996,-96.66889379999999,14z/data=!4m8!1m2!2m1!1sBaker+Brothers+Plumbing%2C+Air+%26+Electric!3m4!1s0x864e99246aaaaaab:0x3be596d64a29da76!8m2!3d32.800499099999996!4d-96.66889379999999","https://www.google.com/maps/place/Baker+Brothers+Plumbing%2C+Air+%26+Electric/@32.800499099999996,-96.66889379999999,13.99z/data=!4m16!1m7!3m6!1s0x864e99246aaaaaab:0x3be596d64a29da76!2sBaker+Brothers+Plumbing%2C+Air+%26+Electric!8m2!3d32.800499099999996!4d-96.66889379999999!16s%2Fg%2F11ckvg1dmb!3m7!1s0x864e99246aaaaaab:0x3be596d64a29da76!8m2!3d32.800499099999996!4d-96.66889379999999!9m1!1b1!16s%2Fg%2F11ckvg1dmb?entry=ttu",https://lh4.googleusercontent.com/-COzZ2knlvRc/AAAAAAAAAAI/AAAAAAAAAAA/vf8UIDeX3TY/s44-p-k-no-ns-nd/photo.jpg,-96.66889379999999,,"Baker Brothers Plumbing, Air & Electric",Baker Brothers Plumbing Air And Electric,,,115398534578755293065,https://www.google.com/maps/contrib/115398534578755293065,"Baker Brothers Plumbing, Air & Electric",+1 214-324-8811,AT&T,,https://lh3.googleusercontent.com/gps-cs-s/AHVAweo0PCx5OwZgX-7NdnYN0QLiKub8fAfRbofyAsfGUNps7WkklFeNVP5VG_mZ3UQ_3r4wxRpEHydc4RVOsyaiF0462onnSFukxnjj_OSMIHT_cLQ6-3RhJbnCJw0qMWLhSnRTXcw=w800-h500-k-no,546,ChIJq6qqaiSZToYRdtopStaW5Ts,,,75150,,,"Electrician near Mesquite, TX",,4.8,,,,,,,Texas,TX,2615 Big Town Blvd,,"Electrician, Air conditioning repair service, Drainage service, Plumber, Furnace repair service, Heating contractor, HVAC contractor, Septic system service, Water softening equipment supplier",America/Chicago,Electrician,,True,https://bakerbrothersplumbing.com/%3Futm_campaign%3Dgmb_bk-msq_home_everyone_gmb-mesquite%26utm_medium%3Dgmb%26utm_source%3Dgoogle,{'Wednesday': ['Open 24 hours']},
{},"3730 Dilido Rd #209, Dallas, TX 75228",False,,OPERATIONAL,,8270539376322731574,Dallas,3730 Dilido Road,Dallas,United States,"Call today for $50 Discount - A + BBB Member, Dallas Electric Repairs for residential and commercial electric problems. Contact Caddell Electric Today 214-329-4567",,https://facebook.com/caddellelectric,,CONSTRUCTION,False,"Call today for $50 Discount - A + BBB Member, Dallas Electric Repairs for residential and commercial electric problems. Contact Caddell Electric Today 214-329-4567",,Caddell Electric,+1 214-329-4567,,landline,,TX,America/Chicago,,LanceCaddell,75228,United States of America,US,,,0x864ea3c32a2dd5fd:0x72c6dbbe5a98de36,8926cb9040fffff,/g/1tfcj4xp,32.798924,,,"https://www.google.com/maps/place/Caddell+Electric/@32.798924,-96.68699459999999,14z/data=!4m8!1m2!2m1!1sCaddell+Electric!3m4!1s0x864ea3c32a2dd5fd:0x72c6dbbe5a98de36!8m2!3d32.798924!4d-96.68699459999999","https://www.google.com/maps/place/Caddell+Electric/@32.798924,-96.68699459999999,13.99z/data=!4m16!1m7!3m6!1s0x864ea3c32a2dd5fd:0x72c6dbbe5a98de36!2sCaddell+Electric!8m2!3d32.798924!4d-96.68699459999999!16s%2Fg%2F11ckvg1dmb!3m7!1s0x864ea3c32a2dd5fd:0x72c6dbbe5a98de36!8m2!3d32.798924!4d-96.68699459999999!9m1!1b1!16s%2Fg%2F11ckvg1dmb?entry=ttu",https://lh3.googleusercontent.com/-jwodJot94P0/AAAAAAAAAAI/AAAAAAAAAAA/xaF3wY2pWVA/s44-p-k-no-ns-nd/photo.jpg,-96.68699459999999,,Caddell Electric,Caddell Electric,,,114730762563636738923,https://www.google.com/maps/contrib/114730762563636738923,Caddell Electric,+1 214-329-4567,,landline,https://lh3.googleusercontent.com/p/AF1QipMBRVkvZI9E5IWuazS2ETp45BtuUPrZaXBoUwFW=w800-h500-k-no,92,ChIJ_dUtKsOjToYRNt6YWr7bxnI,,,75228,,,"Electrician near Mesquite, TX",,4.9,,,,,,,Texas,TX,3730 Dilido Rd #209,,"Electrician, Landscape lighting designer, Lighting contractor",America/Chicago,Electrician,,True,https://www.dallaselectricrepair.com/,{'Wednesday': ['7:30AM-5PM']},"Wednesday,7:30AM,5PM"
{},"1831 Big Town Blvd, Mesquite, TX 75149",False,,OPERATIONAL,,15283473352103693342,Mesquite,,,,,,,,,,,,,,,,,,,,,,United States of America,US,Riverway Estates/Bruton Terrace,,0x864ea300038800ef:0xd419ce09d64a0c1e,8926cb9051bffff,/g/11vrrp1167,32.7891006,,,"https://www.google.com/maps/place/Mesquites+Electrical+Services/@32.7891006,-96.6685234,14z/data=!4m8!1m2!2m1!1sMesquites+Electrical+Services!3m4!1s0x864ea300038800ef:0xd419ce09d64a0c1e!8m2!3d32.7891006!4d-96.6685234","https://www.google.com/maps/place/Mesquites+Electrical+Services/@32.7891006,-96.6685234,13.99z/data=!4m16!1m7!3m6!1s0x864ea300038800ef:0xd419ce09d64a0c1e!2sMesquites+Electrical+Services!8m2!3d32.7891006!4d-96.6685234!16s%2Fg%2F11ckvg1dmb!3m7!1s0x864ea300038800ef:0xd419ce09d64a0c1e!8m2!3d32.7891006!4d-96.6685234!9m1!1b1!16s%2Fg%2F11ckvg1dmb?entry=ttu",https://lh6.googleusercontent.com/-Psg4ITKLz3k/AAAAAAAAAAI/AAAAAAAAAAA/oF8nsTQdYCY/s44-p-k-no-ns-nd/photo.jpg,-96.6685234,,Mesquites Electrical Services,Mesquites Electrical Services,,,112197637030786563161,https://www.google.com/maps/contrib/112197637030786563161,Mesquites Electrical Services,+1 469-393-5985,,landline,https://streetviewpixels-pa.googleapis.com/v1/thumbnail?panoid=qLsT6Sdvg0ti8FiIZFuTnw&cb_client=search.gws-prod.gps&w=800&h=500&yaw=200.05276&pitch=0&thumbfov=100,1,ChIJ7wCIAwCjToYRHgxK1gnOGdQ,,,75149,,,"Electrician near Mesquite, TX",,5.0,,,,,,,Texas,TX,1831 Big Town Blvd,https://streetviewpixels-pa.googleapis.com/v1/thumbnail?panoid=qLsT6Sdvg0ti8FiIZFuTnw&cb_client=search.gws-prod.gps&w=1600&h=1000&yaw=200.05276&pitch=0&thumbfov=100,Electrician,America/Chicago,Electrician,,True,,{'Wednesday': ['7AM-8:30PM']},"Wednesday,7AM,8:30PM"
{},"1636 Range Dr, Mesquite, TX 75149",False,,OPERATIONAL,,8283672547156107625,Mesquite,,,,,,,,,,,,,,,,,,,,,,United States of America,US,Beltline Range,,0x864ea54598c1e28b:0x72f5844af8e52169,8926cb92d0bffff,/g/11vc7gjspw,32.786055,,,"https://www.google.com/maps/place/Mesquites+Electric+Services/@32.786055,-96.5983771,14z/data=!4m8!1m2!2m1!1sMesquites+Electric+Services!3m4!1s0x864ea54598c1e28b:0x72f5844af8e52169!8m2!3d32.786055!4d-96.5983771","https://www.google.com/maps/place/Mesquites+Electric+Services/@32.786055,-96.5983771,13.99z/data=!4m16!1m7!3m6!1s0x864ea54598c1e28b:0x72f5844af8e52169!2sMesquites+Electric+Services!8m2!3d32.786055!4d-96.5983771!16s%2Fg%2F11ckvg1dmb!3m7!1s0x864ea54598c1e28b:0x72f5844af8e52169!8m2!3d32.786055!4d-96.5983771!9m1!1b1!16s%2Fg%2F11ckvg1dmb?entry=ttu",,-96.5983771,,Mesquites Electric Services,Mesquites Electric Services,,,,,Mesquites Electric Services,+1 972-309-9230,,landline,https://streetviewpixels-pa.googleapis.com/v1/thumbnail?panoid=flWyCRyPSPICSEk4a4SzbQ&cb_client=search.gws-prod.gps&w=800&h=500&yaw=178.80164&pitch=0&thumbfov=100,1,ChIJi-LBmEWlToYRaSHl-EqE9XI,,,75149,,,"Electrician near Mesquite, TX",,5.0,,,,,,,Texas,TX,1636 Range Dr,https://streetviewpixels-pa.googleapis.com/v1/thumbnail?panoid=flWyCRyPSPICSEk4a4SzbQ&cb_client=search.gws-prod.gps&w=1600&h=1000&yaw=178.80164&pitch=0&thumbfov=100,Electrician,America/Chicago,Electrician,,False,,{'Wednesday': ['7AM-7:30PM']},"Wednesday,7AM,7:30PM"
